objectid,id,filename,barcode,ephemera_box_number,folder_number,format,title,sort_title,alternative_title,transliterated_title,language,ocr_language,creator,contributor,publisher,genre,width,height,subject,geo_subject,location,latitude,longitude,description,date,rights_statement,collection_titles
obj001,1540cc25-188d-4034-9a6f-ec9c8db89d23,1540cc25-188d-4034-9a6f-ec9c8db89d23.jpeg,32101106997305,20,928,image/jpeg,За экономию и бережливость,за экономию и бережливость,,Za ėkonomii︠u︡ i berezhlivostʹ,Russian,rus,"Потиевский, В. А.","Potievskiĭ, V. A.",Издательство политической литературы Украины,Posters,28,43,Economic policy;Kommunisticheskai︠a︡ partii︠a︡ Sovetskogo Soi︠u︡za;Propaganda,Russia (Federation),Ukraine,49.06758788,31.24158238,"This poster is part of the set ""Trudovoĭ informator"" (folders #917-933 / Box#20)",1983,http://rightsstatements.org/vocab/InC-RUU/1.0/,Princeton Slavic Collections
obj002,4f6ac146-a907-4076-9bb8-ab9f848141cf,4f6ac146-a907-4076-9bb8-ab9f848141cf.jpeg,32101111939284,33,1713,image/jpeg,Не для вiйни ростимо ми синiв,не для вiйни ростимо ми синiв,,Ne dli͡a viĭny rostymo my syniv,Ukrainian,ukr,"Кудряшова, К. А.","Kudri͡ashova, K. A.",Політвидав України;Politvydav Ukraïny,Posters,29,43,"Holidays;Armed Forces;Peace movements;Propaganda;World War, 1939-1945",Russia (Federation);Ukraine,Ukraine,49.06758788,31.24158238,"This poster belongs to the set ""Slavymo podvyh, slavymo myr!""",1985,http://rightsstatements.org/vocab/InC-RUU/1.0/,Princeton Slavic Collections
obj003,c43a46e9-ca92-4fad-8624-706731b23ac9,c43a46e9-ca92-4fad-8624-706731b23ac9.jpeg,32101109408763,35,1934,image/jpeg,"""Анти-Дюринг""","""анти-дюринг""",,"""Anti-Di͡uring""",Russian;German,rus,"Козлов, Леонид","Kozlov, Leonid;Рудяк, Борис  ;Rudi͡ak, Boris;Яковлев, Борис  ;I͡akovlev, Boris","Плакат;Verlag ""Plakat""",Posters,20,28,Arts--Political aspects;Communism;Socialism,Russia (Federation),Russia (Federation),62.53032163,94.38671659,"This poster is part of the set ""Fridrikh Ėngelʹs"". Introductory article by Boris Rudi͡ak and Boris  I͡akovlev. Translation into German by V. Grigor'eva and S. Dezhurov.",1984,http://rightsstatements.org/vocab/InC-RUU/1.0/,Princeton Slavic Collections
obj004,bd29beb3-a6f2-4432-ba04-5720674184a2,bd29beb3-a6f2-4432-ba04-5720674184a2.jpeg,32101109408961,35,1954,image/jpeg,III Интернационал,iii интернационал,,III Internat͡sional,Russian;German,rus,"Козлов, Леонид","Kozlov, Leonid;Рудяк, Борис  ;Rudi͡ak, Boris;Яковлев, Борис  ;I͡akovlev, Boris","Плакат;Verlag ""Plakat""",Posters,20,28,"Arts--Political aspects;Communism;Lenin, Vladimir Ilʹich, 1870-1924;Revolutionaries;Socialism",Russia (Federation),Russia (Federation),62.53032163,94.38671659,"This poster is part of the set ""Vladimir Ilʹich Lenin"".Introductory article by Boris Rudi͡ak and Boris  I͡akovlev.Translation into German by V. Grigor'eva and S. Dezhurov.",1984,http://rightsstatements.org/vocab/InC-RUU/1.0/,Princeton Slavic Collections
obj005,a6c772fe-750e-4cbb-b780-2cbd3eaf9f95,a6c772fe-750e-4cbb-b780-2cbd3eaf9f95.jpeg,32101111625172,41,2179,image/jpeg,Обеспечить дальнейшее развитие санаторно-курортного лечения...,обеспечить дальнейшее развитие санаторно-курортного лечения...,,Obespechitʹ dalʹneĭshee razvitie sanatorno-kurortnogo lechenii͡a...,Russian,rus,"Викторов, В.","Viktorov, V..;Рачко, В.;Rachko, V.",Изобразительное искусство,Posters,18,23,Economic development;Economic policy;Health facilities;Kommunisticheskai︠a︡ partii︠a︡ Sovetskogo Soi︠u︡za;Propaganda,Russia (Federation),Russia (Federation),62.53032163,94.38671659,"This poster is part of the set ""Rubezhi novoĭ pi͡atiletki 1971-1975"" Posters # 2151-2184",1971,http://rightsstatements.org/vocab/InC-RUU/1.0/,Princeton Slavic Collections
obj006,691514fc-2507-4ad0-af7b-bfc2a95d7f90,691514fc-2507-4ad0-af7b-bfc2a95d7f90.jpeg,32101111624910,41,2153,image/jpeg,Всемерно развивать фундаментальные и прикладные научные исследования,всемерно развивать фундаментальные и прикладные научные исследования,,Vsemerno razvivatʹ fundamentalʹnye i prikladnye nauchnye issledovanii͡a,Russian,rus,"Викторов, В.","Viktorov, V..;Рачко, В.;Rachko, V.",Изобразительное искусство,Posters,18,23,Economic development;Economic policy;Kommunisticheskai︠a︡ partii︠a︡ Sovetskogo Soi︠u︡za;Propaganda;Science and technology,Russia (Federation),Russia (Federation),62.53032163,94.38671659,"This poster is part of the set ""Rubezhi novoĭ pi͡atiletki 1971-1975"" Posters # 2151-2184",1971,http://rightsstatements.org/vocab/InC-RUU/1.0/,Princeton Slavic Collections
obj007,2e29a732-01bf-4fde-8b58-95d7f6128cde,2e29a732-01bf-4fde-8b58-95d7f6128cde.pdf,32101111627426,45,2531,application/pdf,Будь готов! Всегда готов!,будь готов! всегда готов!,,Budʹ gotov! Vsegda gotov!,Russian,rus,"Финогенов, А.","Finogenov, A. ;Кассиль, Д. ;Kassilʹ, D. ",Плакат,Posters,41,53,Children;Youth--Political activity;Kommunisticheskai︠a︡ partii︠a︡ Sovetskogo Soi︠u︡za;Propaganda;Economic and social development;Societies and clubs,Russia (Federation),Russia (Federation),62.53032163,94.38671659,Set cover,1981,http://rightsstatements.org/vocab/InC-RUU/1.0/,Princeton Slavic Collections